comments,star_rating,tags
"I passed his class with a B. He was unpleasant at times and his teaching style was very old-world. He did have a unique take on history (anti-American, anti-Atheist, anti-Lutheran, etc., compared early Christians to hippie welfare bums). He is very full of himself but his class isn\'t too hard to pass if you take decent notes. Easy tests.",3.1,"unpleasant, old-world, unique take on history, anti-American, anti-Atheist, anti-Lutheran, full of himself, easy tests"
No Comments,3.2,NA
easy class as long as you dont mind to write about 11 1-2 page papers and 2 big papers. no tests or homework other than the papers. shes def out there though dont count on learning anything in class shes in her own world,3.5,"easy, papers, out there, own world"
"Porof.Berg is a great guy, he makes the course interesting and fun, also he is clear with the material and makes it easy to understand, however, his test are a bit on the hard side, you must know the material inside out.",4.2,"great, interesting, fun, clear, easy to understand, hard, knowledgeable"
She seems very on organized imformation on speeches is all over between the internet and the handouts. I often got marked off for not using the write bullet points. Easy class though but don\'t recommend it.,3.5,"disorganized, marked off, easy class, not recommend"
most fun classes ever..Julie is an awesome teacher and anyone who thinks otherwise needs their head checked...,3.1,"fun, awesome, NA"
"Dr. Neal is a very hard, very nice teacher. He is also one of my favorite people alive. He is dedicated to the students and cares about them to the fullest; he is always, always, open to emails, meetings of any time/type. He is a very tough teacher however and be prepared to be challenged completely.",3.7,"hard, nice, favorite, dedicated, cares, open, tough, challenged"
Lecture moves like a slug. Teaching style is mundane. Lecture seems like a seminar. She is kind of rude. Snobbyish. Stays on the same point for long periods of time. She asks too much of the class (in terms of questions). You can tell what she\'s going to say before she says it.,3.3,"slow, mundane, seminar-like, rude, snobby, repetitive, demanding, predictable"
One of the best teachers at FIU.,4.3,"best, teacher, FIU"
One of my favorite profs. Went off on weird tangents but obviously knew and loved the material.,3.8,"favorite, knowledgeable, passionate"
tinas labs are better than trevors,2.8,NA
Ehh,3.7,NA
"You can tell he loves the material, and it is boring sometimes, but this class was definitely really cool. He made the tests SO EASY, you get a cheat sheet for every one, so theres no way to NOT get a good mark. He takes test material right out of the book and only does more challenging math on assignments, which he will help you do if you ask.",2.6,"passionate, boring, engaging, easy tests, cheat sheet, helpful, challenging math"
This professor was a great one. I looked forward to attending this class every week. He really knows what he\'s talking about and is a great teacher. There is a good amount of work and it is mostly online but if you keep up with the workthen you\'ll do fine. Highly Recommeded,2.9,"great, knowledgeable, great teacher, highly recommended"
Crikey! You\'ve got a carrot in a microwave!,3.0,NA
"His exams are incredibly specific and unless you start studying 2 weeks before the exam, do not expect higher than a 70 on any of his tests. I rewrote the entire textbook and went to the learning center to review for his class. I ended up getting an A but I worked for it. He knows his exams are hard though so he\'s a bit more lenient with the gradin",2.8,"specific, challenging, hardworking, lenient"
Sound informative and very interesting. Does bring family home life into class but always puts them in context of lessons being taught. Love her.,3.0,"informative, interesting, contextual, loving"
"If everyone approached life as she does we would have a better world, and Minority Group should be a mandatory class for every major, maybe then we would learn tolerance for others and thier cultures and not be so closed minded, we are in college where we should all have open minds to new things, how else can you grow as a person...",4.2,"inspirational, open-minded, tolerance, mandatory, college"
Caliente!!! Need I say anymore,4.3,"energetic, passionate"
her classes were AGONIZING. Almost never did her code work. And she\'d spend the rest of class helping one student try to get HER code fixed. Aweful!,2.5,"AGONIZING, code not working, helping one student, Aweful"
awesome teacher awesome guy if you get the chance take him for any class even if its not a CRJ,4.2,"awesome, teacher, awesome, guy, take him, class"
"Fantastically high energetic, has great stories and amazing experiences. Most importantly, you leave with a better portfolio and knowing a lot more about the graphic design world.",4.7,"energetic, great stories, amazing experiences, knowledgeable, impactful"
She is sweet but SO HARD to pay attention to. Tests are difficult even with a study guide. I studied hard for every one but never made an A.She passes around a sign in sheet every day. LOTS of opportunities for bonus points. It could be better but it could be worse.,4.2,"sweet, hard, difficult, study guide, bonus points"
"He is the best professor in entire UHCL .I have seen most of the professors in UHCL but none like him , character wise and as a teacher. Very soft person , dosent get angry at all. He knows the subject very well and has great knowledge in it . Most on them take advantage of his lineance and dont listen to class .Hes a great personality.",3.0,"best professor, soft, knowledgeable, great personality"
"the most passionate prof\'s I\'ve had at York. She loves what she does. Must read the text, really interesting. Fair marker. Museum assignment is time consuming but great. She uses videos for some of her lectures and everything she covers in lecture is posted. Study, read text do reflections and assign, and u\'ll do well",4.1,"passionate, loves what she does, fair marker, time consuming but great, uses videos, everything covered in lecture posted, study, read text, reflections, do well"
"i took him for speech and we wrote like 6 or 7 speeches all tests are from the book, he grades real hard and if you have a heavy schedule don\'t take him, he gives out lots of work.",2.6,"strict, challenging, heavy workload, book-based tests"
Dean Frank is one of the nicest people I have ever met in my life. She takes her students very seriously and will take the time to listen. She will do anything to help her students. She is very sweet and knows how to make anyone feel better. She is one of the best faculty members at Kennesaw State.,2.5,"nice, serious, helpful, sweet, best"
Easy class. Sweet professor. No studying necessary.,3.0,"Easy-going, Sweet, NA"
I really liked her teaching style. Compared to the other speech teachers she is very good.,4.4,"liked, teaching style, good"
"Brandy got married and is now Brandy Zito Frost. You have to work in this class, there are several projects, but everything you do benefits you personally and professionally, it is not just busywork. I strongly encourage everyone to take this class. It is helpful, and Brandy is the best!",3.8,"encouraging, helpful, best"
"he\'s awesome. Lots of blackboard work, but he\'s really helpful and makes things interesting.",3.4,"awesome, helpful, interesting"
"His lectures are GREAT. He adds humor....which is good because it was an evening class and he kept us awake. He involved us all in his lectures. His tests are difficult essay questions, but if you study the notes you will do ok.",4.6,"great, humor, engaging, difficult tests, study notes"
No Comments,2.9,NA
"She makes chemistry sound easy. She teaches slowly, straight from her slides. The tests come straight from that, but be careful with math mistakes. If you have the choice of professors for this class, take her.",4.3,"knowledgeable, clear, organized, recommended"
"I\'ve had this professor twice now for two different classes and he tries to teach the exact same material. He told us in class that he expects us to learn it on our own, and he expects that we will fail. With having a open note, open book and partner test and the class average was 51% DO NOT TAKE THIS PROFESSOR.",1.6,"uninspiring, unhelpful, unorganized, discouraging"
"Excellent choice of subject matter and good lectures. Very, very nice professor. Some were afraid this theory course would be dry but Sparks managed to make it meaty and interesting.",3.8,"excellent, nice, interesting"
I just love her! What a great professor!,4.1,"friendly, passionate"
"very very intelligent! Funny, helpful, and a cat lover!!",2.6,"intelligent, funny, helpful, cat lover"
Very nice and helpful. She\'s very enthusiastic about microorganisms and infectious diseases. Allowed me an extension on my paper.,3.8,"helpful, enthusiastic, nice"
"Prof. Sinning is awesome. She makes tax accounting much more understandable than reading the book. My advice - do not buy the book and go to class all of the time. WARNING!!! She will throw information into tests that you have never seen before to ""trip you up,"" so be careful. Make sure that you know her notes (ALL OF THEM) or you will fail.",4.7,"awesome, understandable, WARNING, careful, fail"
"Personally, I think she puts to much time into other choirs and not Concert Choir. Choir was horrible because of this, and not to mention we sang all the same songs the whole year.",4.0,"unorganized, neglectful, repetitive"
She is a tough teacher but she will make sure you learn how to write a paper on a college level and make sure you come to class on time everyday cause she will point and snap you out her class. very funny.,3.5,"tough, ensures learning, punctual, funny"
"Jasken\'s very nice, engaging, etc., but her class activities are a little too...squishy...to be relevant to the subject matter. I don\'t know why this was a 3000-lvl class. Also, it\'s teaching outdated technology -- not entirely Jasken\'s fault, but she clearly wasn\'t up on current standards.",4.5,"engaging, outdated technology, not up to date"
"Excellent teacher, and it shows he still currently teaches high school. Problem Solving was the easiest math course ive EVER taken (and im a math major). I would honestly be surprised if there was a person in the class who got less than an A-. Easy course even for the math challenged!",4.8,"Excellent, high school teacher, problem solving, easiest course, math major, surprised, A-, easy course, math challenged."
He is very helpful and is willing to give his time to you. He also lets class decide if they want to be there or not at times,3.4,"helpful, willing, lets class decide"
"He\'s definitely not a creep! Dr. Caspi is a great teacher, and I learned so much from him. You have to go to class and the work is fair and reasonable. He likes students that make an attempt to speak up in class and give their input. Overall-a great professor!!",4.0,"friendly, knowledgeable, engaging, fair, reasonable"
He is AMAZING! The funnest class I have had all semester. He\'s knows his material and is always willing to help.,4.7,"AMAZING, funnest class, knows his material, willing to help"
"I took Professor Rose\'s internship seminar after taking his Intro to Media Industries a few semesters ago. There\'s absolutely nothing bad to say about the experience with this class. The discussion board assignments we had were like journaling and he has a genuine interest in how students will take their careers. Take him, you won\'t regret it.",4.1,"knowledgeable, engaging, supportive, passionate"
"Best teacher i have ever had! loved his classes more then other i took. RIP Jim, you will be missed greatly.",4.5,"Best teacher, loved classes, RIP Jim, missed greatly"
Moliassa is a hilarious & makes math fun! He often came to class with chalk all over his face & always said good morning even though it was evening. He was very helpful and clarified a lot of topics for me. After having Moliassa for pre-calc I became so interested in math that I ended up taking calculus even though it\'s not required for my degree.,4.3,"hilarious, fun, helpful, clarifies topics, inspiring"
"Professor griffin is very rude . She missed class at least three times for personal reasons, which is fine , life happens !!! But lets hope it doesnt happen to you because she will give you an F for missed assignments ! No late turn ins. She is unreasonable . Rude. And unhappy . I worked extremely hard and still for a D . Her grading is bias.",3.0,"rude, unreasonable, unhappy, biased"
she\'s awesome! if you want to learn how to take awesome pictures take her! she loves to help and is helpful the best professor Chaffey has! I would take her class again totally if you have the chance to take her and learn photography definitely recommended,4.4,"awesome, helpful, best professor, recommended"
Super easy. Really funny guy. Doesn\'t have class on fridays.,4.1,"easy, funny, NA"
"you have to go to class or else you won\'t do well. her lecture notes are all the tests. just copy those and you\'ll do fine. she grades hard on the papers, but offers extra credit. i learned a lot from her.",2.5,"strict, organized, knowledgeable, challenging"
"Great professor for learning, but needs to be more lenient for a 100 level course. Grades a little too hard on speeches and assigns way too many other assignments and papers besides the speech itself.",4.5,"Great, learning, lenient, hard, speeches, assignments, papers"
"I took Dr. Kurtz\'s civil rights rhetoric course a few years ago, and I am still recommending some of his course texts. Class was always eventful and challenging and focused in a weird fun sort of way. He is also invested in his students, and fully encouraging.",4.0,"encouraging, invested, challenging, eventful, fun"
"Im Hispanic, came to class half awake after work ending at 8:30am, to her class starting at 9am. Loads of Extra Credit, Its impossible to not want to try. I\'m a C student, If I can get an A in this class, anyone reading this should be able to do the same. Take here class, Trust: No Regrets. PCC\'s Best teacher Hands down. PS: She is SUPER NICE!!!!!!",4.7,"Hispanic, loads of Extra Credit, impossible, A student, Trust, No Regrets, Best teacher, SUPER NICE"
"This man knows NOTHING about Chinese history. His lectures are unclear, and cannot field question from students. Very arrogant, and unaccomodating. The department should look for a new prof to take over the Chinese history courses.",2.3,"arrogant, unaccomodating, unclear, NA"
"He never gives real homework assignments. Your grades are based solely on a few papers and the tests you write. He is very vague about what is going to be on the test, and reviewing just confused me more. Nice guy but needs to clarify what we exactly need to know succeed in the class.",3.7,"vague, needs clarification, nice"
Nice person but perhaps on a different intellectual level at times. Lectures can be hard to understand. She will always help you if you ask and not too hard on due dates. Can grade hard at times.,2.5,"Nice, intellectual, hard to understand, helpful, not too hard, hard grading"
"not an easy a, must do everything to a T to do well. she plays favorites and i was definitely not one. my advice would be to get on her good side and you should do well.",4.5,"strict, favorites, advice"
He\'s hilarious man. I enjoyed attending his classes. I highly recommend him for non-bio majors.,4.0,"funny, enjoyable, recommended"
"BvB is one of the best professors at GW. She has a love for Renaissance art, which is infectious. Her lectures are fascinating and clear, and she is a pretty easy grader. She really cares about her students, so it pays to get to know her. I have taken many classes with her and hope to take more. She is everything a student could ask for.",4.6,"best professor, love for Renaissance art, infectious, fascinating lectures, clear lectures, easy grader, cares about students, get to know her, everything a student could ask for"
"The man will make you work for your grade, however, in the end, if you do not know the information, it is simply because you are not paying attention or reading. The man laids things out for you so clearly, that sometimes, you wonder if you are truly doing the work! He is that damn good! You would enjoy his class!!",3.6,"strict, clear, engaging, effective"
avoid,3.7,NA
He is a great Prof. He knows what he is doing. His beard is also very hot and his silver hair makes him distinguished.,4.1,"great, knowledgeable, hot beard, distinguished, NA"
Just the worst.,3.1,worst
He is explains things thoroughly. He uses example in real life and he makes it interesting.,4.5,"thorough, real-life examples, interesting"
"Online course, READ textbook, and you will be fine. Grades hard on papers, forum assignments are easy, but you must complete them.",3.0,"Online course, READ textbook, grades hard, forum assignments easy, must complete."
"Ok on reg assignments. Her tests are the problem. Seems she wants students to fail. Her exam reviews do not pertain to the test material. She takes the simplest thing and complicates it to the point of confusion. She constantly mispronounces words. All attendance taken within the first 30 seconds of class. Don\'t be late, will deduct points.",2.9,"problematic, unhelpful, confusing, mispronounces words, strict"
Awesome teacher!!! She introduced me to sign lang and now I want to interpret ;). She really cares for her students and supports them 100%. She also makes sure your grasp the importance of facial expressions. Though the class in normally later in the day-you will enjoy attending this class!,4.8,"Awesome, caring, supportive, importance of facial expressions, enjoyable"
"Overbearingly rude and thinks it\'s cute. He is very harsh and views himself as merely ""demanding."" The actual material and class is pathetically easy, but he tests over inane details and is rude to any students with questions. Even intelligent and well thought-out questions usually result in him announcing to the class that you have wasted his time",3.3,"rude, harsh, demanding, pathetically easy, tests inane details, rude to students, wasted time"
He basically gives the type of questions that are asked on the exams and final. He mainly just takes questions from hw and lecture notes and just changes them a bit. So if you understand the concept your fine. It is important that you come to his classes on time.,3.5,"exams, final, questions, homework, lecture notes, concept, punctual"
John is so cute. He doesn\'t have a greater-than-thou attitude like most teachers. He has great life experience and is a true English gentleman. He is very helpful and puts his heart into his teaching.,4.3,"helpful, great life experience, true English gentleman, puts heart into teaching"
"Great teacher! Professor Andy Jones made the six-week quarter fly by. I liked his PowerPoint quizzes, and his crazy allusions. The class is a lot of work, but he grades fair. I really appreciated Andy\'s wide-eyed humor - he connects almost everything we read to other assigned works, or to pop culture. I would take another class with him in a minute",4.4,"Great teacher, engaging, fair grader, humorous, connects material well, pop culture references"
"Pretty funny which makes even 3 hour lectures feel short. Although, he is probably more skilled on how to make his students feel stupid rather than the actual subject of Philosophy. I started out the class with about 30 classmates and half way through only 8 of us were left. You have to work extremely hard to even receive a B. Would NOT recommend.",3.5,"funny, skilled, makes students feel stupid, challenging, not recommended"
Topp truly cares about her students and definitely has a passion for what she teaches. I would recommend her class to everyone!,5.0,"caring, passionate, recommend"
The class is interesting and easy. Sheila is a wonderful women and very sweet!,3.5,"interesting, easy, wonderful, sweet"
"Don\'t get me wrong, I love Dr. Lorden to death and she\'s a really sweet, funny lady, but the amount of work she assigns is beyond ridiculous. Every night you have to take 1-2 quizzes, as well as around 50 pages of reading. In addition to that, there\'s frequent busywork assigned. The material was not that difficult though.",3.8,"sweet, funny, ridiculous, frequent busywork, NA"
shes good. the fredrick douglas and primary documents stuff is whak though,4.9,"good, NA, whak"
HARD CLASS. Do NOT take. I heard it was easy but it most certainly was not.,3.8,"HARD CLASS, Do NOT take, easy NA"
an incredible professor and one of the most intellegent in the entire school.,4.4,"incredible, intelligent"
"Dr. Parker is extremely reliable and he genuinely cares about his students and will put your priorities in front of his own. He referred to Excel as ""a stupid computer program"" just about every class, which surprisingly got more and more hilarious with time",4.4,"reliable, caring, priorities, hilarious"
very confusing. i regret enrolling in this class. his soc 128 class is way more tolerable than soc 129.,2.2,"confusing, regret, tolerable"
Tressa is the kindest teacher in the department. She\'s an easy grader and is very patient with people who struggle. She is also just adorable in general. Such a kind-hearted person.,4.4,"kind, easy grader, patient, adorable, kind-hearted"
Absolutely AWFUL prof! Was a grad student at the time and loaded coursework down on us like crazy! Very unclear and very tough grader! Spent my whole summer reading very difficult books. :(,2.8,"AWFUL, tough grader, unclear, loaded coursework"
Terrific teacher in every facet. He has perfected the teaching of E321.,3.9,"Terrific, perfected, teaching"
Highly would not recommend taking a class with this individual. His grading scale/requirements for exams is non existent and his professionalism/integrity as a professor is severely lacking to say the least.,3.2,"unprofessional, lacking integrity, not recommended"
She is a good teacher who cares about all of her students.,2.1,"caring, good teacher"
The BEST professor at Oakland EVER! He is very passionate about what he teaches and is very eager to help if you have questions or problems. He goes out of his way to make learning not only fun but rewarding as well. I can\'t say enough GREAT things about him! I would take more classes with him if I could! Oakland needs more professors like him!!,4.4,"passionate, eager to help, fun, rewarding, great"
One of the most fake people I have ever known. Snotty and condescending in almost every comment she makes to students. Not in touch with people she\'s trying to teach at all. Not very understanding of even extenuating circumstances.,4.4,"fake, snotty, condescending, not understanding"
Jon is one of the best people I have ever met. His passion for theatre and his extreme knowledge and skill in theatre is very evident. Any class you take with him has a profound impact on you. But it\'s the times just working with him that you learn most.,5.0,"passionate, knowledgeable, skilled, impactful"
"Good labs, lousy lectures.",3.5,"Good labs, lousy lectures
NA"
"Prof Douglass seems to have social awkwardness which everyone seems to define as \'bad\'. He seems very particular about his notes and wont defer. If you have a question he is notorious for saying \'it is in the syllabus\' and then wont answer. Wasnt hard work, was hard to figure what he wanted. He is monotone, just reads notes, very dull class.",2.0,"awkward, particular, notorious, monotone, dull"
"Good prof., but I must say that he gets boring after telling u the same stories about his business, family, etc. SO, Ken stop wondering why people stop coming to your EIGHT O\'CLOCK classes!!! All that aside, good guy, choose him and you\'ll have it very easy. (1midterm, 1 pro, and 1 final)",2.6,"Good prof, boring, repetitive, easy-going, good guy."
"Always well prepared, entertaining and educational - always learned something and was never bored. Lots of writing assignments but tests are open notes (but hard). Come to class, do the work - you will get an A.",4.3,"well-prepared, entertaining, educational, learned something, never bored, lots of writing assignments, open notes tests, hard tests, come to class, do the work, will get an A"
"Can not belive this course is a 100 level course. Lee is great, but the course is definately not 100 level material. I have sailed through some 400 level courses that didn\'t compare to the level of difficulty in this course. Avoid it if you can.",3.5,"great, difficult, avoid"
"The rumors are true - she is a very difficult woman. But if you need chem for your degree, you can\'t avoid her, she is the senior lab instruction for 1st yr labs (and the \'prof\' for 091 - though you have to teach yourself everything, its online). Be prepared, get your work in ON TIME and hope for the best, its not likely she\'ll have any grace :/",1.7,"difficult, senior lab instructor, 1st year labs, online, no grace"
"Mrs. Moore is an excellent teacher. She knows her subjects and is helpful to all. She requires students to do their best and to abide by all deadlines, but that is what real life is like. She does a great job preparing students for their futures.",3.6,"excellent teacher, knowledgeable, helpful, high expectations, prepares students, strict deadlines"
Awesome. Psych 101 made fun. Very comprehensive...really makes you want to be a psych major! Great class! Loved it loved it loved it!,3.8,"Awesome, comprehensive, makes you want to be a psych major, great class, loved it"
He is in my opinion one of the better professors on this campus. He is also a pretty easy going and funny guy.,3.3,"knowledgeable, approachable, funny"
hes nuts and crazy but GREAT! He is so smart!,4.1,"smart, great, nuts, crazy"
