comments,star_rating,tags
His accent is easy to get used to. He does have a sense of humor. Homework is not graded and he only suggests 15-20 problems each week. Quizzes are once a week as well but they are max 3-5 questions and exactly from the homework. Exams are based on the quizzes. If you hate math-take him! Lectures are simple and to the point-he is a great teacher!,3.8,"easy to get used to, sense of humor, simple and to the point, great teacher"
No Comments,3.7,NA
"He\'s very nice, and he possesses a subtle sense of humor, so if you don\'t pay attention in class, you\'re missing out. Care to read another reason you should pay attention in class? Well, he gives three T/F tests per term, and many of the questions refer to seemingly random, unimportant remarks he makes in class. Paying attention+reading the book=A!",4.3,"nice, subtle sense of humor, engaging, attention to detail, challenging"
THE WORST PROFESSOR I\'VE EVER HAD.I WENT INTO HIS CLASS EXPECTING A LOT BECAUSE OTHER STUDENTS RAVED ABOUT HIM. WHAT A MISTAKE...HE\'S ARROGANT AND NAPOLEANIC.,3.3,"worst, arrogant, Napoleonic"
No Comments,4.5,NA
"He really knows what hes talking about but he isn\'t the best teacher. Lectures are very monotone and the only grades are exams and 2 homework\'s a month. He doesn\'t tell you about any deadlines, you are just expected to know when the tests are and when the homework\'s are due. His class does not co-inside with the lab at all!!",2.8,"knowledgeable, monotone, unorganized, lacks communication"
"Absolutely useless. Seriously, he should stick to research. I am barely staying afloat in a subject I have no interest in because I have a decent TA, but if you\'re not so lucky be prepared to teach yourself chemistry. Btw, I counted 250 ""Rights"" in one of his most recent lectures. . Keeps you awake in lecture. . .",2.7,"useless, stick to research, barely staying afloat, no interest, teach yourself, keeps you awake"
Try to take Copper for this class instead because he doesn\'t know how he wants to teach his class.,2.2,NA
"Hated her at first, I thought she won the teachers lotto and thats why she was allowed to teach, *BUT* she is a sweetheart! and will go out of her way to help you...just be patient!!",2.7,"Hated, teachers lotto, sweetheart, patient"
"I loved his class! I think Prof Shangraw is amazing, very knowlegeable and concise. Tough grader, but what do you expect? Its a tough field. Very helpful. He knows his stuff, plus a VERY nice guy, with hot daughters.",4.1,"knowledgeable, concise, tough grader, helpful, nice"
"Great teacher, keep up the good work Lee!",3.5,"Great, teacher, good, work"
"LInda is so nice and so much fun. This class really prepares you for all of your other college classes. She will help you with anything, and she is way funny too.",4.1,"nice, fun, prepares, helpful, funny"
This guy is so into himself and thinks hes tough stuff. If you dont get involved 100% and go on remotes you are not liked. Favorites are clear in his classes.,3.8,"arrogant, demanding, favoritism"
"I had no previous exposure to sociology. Prof. Tim McCauley made it very interesting; I always enjoyed these lectures so much so that I switched into sociology! Overall, very easy course and exams. Check out his website www.yorku.ca/timm/ for he might have the breakdown of the course your looking into (which is always helpful).",3.5,"engaging, interesting, enjoyable, easy-going, helpful"
"Karen is nice, and I liked this class subject I guess, but be prepared to read out of Mike Cullinane\'s book before every class. Each class starts with a reading quiz, and each week you have a HUGE homework due. Tests are exactly like the study guides. Go to her office hours before exams, she\'ll use problems right from the exam to help teach you.",4.5,"nice, liked, be prepared, reading quiz, HUGE homework, tests like study guides, office hours, help teach"
She has a sense of humor and moves at a slow pace for the people who don\'t understand.,4.6,"humorous, patient"
Makes you think but the essays were awesome to read. Very helpful; you need to attend class but will do well if you put in the effort,2.8,"Makes you think, awesome, helpful, attend class, effort"
There are a lot of readings outside of class but he covers the main ideas in lecture well. Papers are pretty big but manageable and he leaves feedback in a timely fashion. I feel like I learned a lot in both Law and the Courts and Law and Politics and would definitely recommend those classes.,3.8,"knowledgeable, organized, engaging, recommended"
"Great Professor, very funny and interesting. The class grade is based on only 3 exams. He curves everything. Going to class and taking notes is very helpful.",3.2,"funny, interesting, helpful, curves grades"
"I took this class these past 8 weeks in the Fall of 2017 and I thought it was going to consists a lot more work like people were saying. Honestly, I learned a lot from the labs we were assigned and he strongly believes in all students! There is nothing that couldn\'t be possible in this class. I would highly recommend him to anyone! Thanks again!",4.0,"knowledgeable, supportive, encouraging, highly recommended"
Damen is an excellent professor. Very excited about what he teaches. You will have to write several papers but they are short and he is an easy grader. He delves into lots of really interesting stuff in his lectures. Great class. I would recommend it to anyone,4.6,"excellent, excited, easy grader, interesting, great class, recommend"
"He\'s hilarious. Works magic with a very very dry subject. Also cute, and gives away $ on occasion...",4.8,"funny, engaging, knowledgeable, generous"
I have learned a lot. I really like him.,4.6,"learned a lot, like"
"The world of chemistry comes easy to Ms. Hunter and she give the impression that it should come easy to everyone. She is fair to students but has little patience if you don\'t understand what she is explaining or if you are taking too long in lab. For someone who is starting back to college after 20+ years out, she\'s a tough teacher to start off w/",2.6,"tough, knowledgeable, fair, impatient"
Great Professor! Math isn\'t my subject but I did great in his class. Took him in the summer so I had to cram a lot into about 8 weeks. He provides a lot of resources for help and responds fast. Great math professor !,4.5,"Great Professor, Math, Great, Summer, Cram, Resources, Help, Responds fast, Great math professor"
"very hard class, 68 was average score on tests, doesn\'t give quizes anymore, and you have to know all the people from the text. nice teacher though.",3.6,"hardworking, challenging, knowledgeable, fair"
"Good teacher. Helpful, if you are here to learn about stats he can help you understand it by simplifying it. I get his class and it\'s easy to understand though I worry about his health. Don\'t listen to people\'s complain about him because they have no interest in math and does not know any bad teacher. I would recommend him to my friends",2.2,"Good teacher, Helpful, Simplifying, Easy to understand, Recommend"
Worst teacher....i counted once and he said right 50 times in a half hour.....i have no idea what he is ever saying ...right?,2.0,"worst, repetitive, confusing"
"Not bad on grading, not the best at getting his point across, better than some but not the best.",3.0,NA
"EASY!!! you dont have to go to class, she lets you do hw online and its extra credit, weekly quiz dont count if they hurt your grade, at the end lets you retake or make up a test of your choice.Test are from quizs and she makes copy of quiz with answers on them! No excuse to not have an A!!",2.9,"EASY, lenient, extra credit, retake option, helpful, accommodating, provides answers"
"She wasn\'t a bad teacher, but her lectures were confusing. She didn\'t seem the friendliest person. I dropped her class... let that be a hint for you all....",3.8,"confusing, unfriendly, dropped"
"He\'s good at the subject and u do learn from his class. However, he sees attendance way more than efforts u put in. He wouldn\'t bother to know ur unforeseen difficulties. Just be there on time even ur body or situations not allow u to do so. Keep ur finger cross that ur body won\'t fail u or run into any kind of emergencies during the 16 weeks.",4.1,"good at subject, learns from class, attendance focused, lacks empathy, rigid on attendance"
"Coleman is a hugely influential teacher and is very knowledgeable, but he is very unclear about his assignments. His final for this class was horrible and he still hasn\'t given back ONE grade from the beginning of the semester. He is intimidating and nothing you say is ever good enough.",2.9,"influential, knowledgeable, unclear, horrible, intimidating, delayed grading"
"I just feel like he just made his course difficult on purpose . On the first day, he told us that more than 50 % of his students fail so i don\'t know if its his fault or the students. He gives out quizzes everyday which is fine but what he teaches in class is completely irrelevant to what he gives out just as stated in the comments below.",3.3,"difficult, irrelevant, demanding, discouraging"
She is a wonderful teacher. I highly recommened taking her.,5.0,"#wonderful, #highly recommended"
Make sure you do as many practice problems as you can to prepare for the test. The test will be much harder then other classes so study and put in the hours. There is no clear grading criteria even though he says there is in the syllabus. I still have no idea what my final numeric grade was. Take a different professor if at all possible,2.3,"hardworking, challenging, unclear expectations, unorganized, unsatisfied"
"outstanding lecturer, cares much about his students...much better than the other two profs...and much better looking",3.9,"outstanding, cares about students, better than others, better looking"
"He is soo freaking stupid! He has this laugh that made me cringe! Nobody comes to class and it is a good class to have if your schedule is demanding. He has no attendance policy, but good luck if you need help outside of class- you won\'t get it.",2.2,"stupid, cringe, demanding, no attendance policy, unhelpful"
"She\'s a little over the top, to the point where I\'d even say she\'s annoying. She\'s obnoxious and loud, which can be cool but only in moderation. Sitting through an hour and a half class twice a week was a bit too much of Shelly for me.",4.5,"over the top, annoying, obnoxious, loud"
Hard but fair,2.8,"hard, fair"
"Super easy class. mid terms can be made up, hw can be late, can earn extra credit for practice problems. He is resourceful and nice. He is kind of old and stutters at times he even takes naps in between breaks and can put you on the spot if you talk but not in a mean way.",3.7,"resourceful, nice, kind, old, stutters, naps, puts on spot"
"Last class she said ""sure"" 79 times. Emphasizes words to the point where you can\'t even stand to listen to her talk. Emphasizes S\'s --soo annoying.",3.1,"annoying, emphasizes, repetitive"
Absolutely horrible professor and experience.,2.1,"horrible, NA"
"Ms. Weeks is French. A little hard to understand at first, but she\'s very helpful and a great teacher.",4.5,"helpful, great teacher"
"She\'s a nice lady but she\'s not the best teacher. She gets off track and kind of bounces around in her lessons. Each question on her tests count for a ridiculous amount of points. She also seems like one of those people who let things build up then will explode on you. If I had to do it over again, I wouldn\'t take her.",3.7,"nice, off track, bounces around, ridiculous points, explosive"
No Comments,4.1,NA
lodi dodi,4.1,NA
"The guy is smart but can\'t teach for his life. The math is EASY and the book is very good. So if your even decent at math then definitly take this course. Subjects include compounding interest, probability, election theory, etc.",2.4,"smart, can't teach, easy, good, decent at math, compounding interest, probability, election theory"
"Great teacher, sometimes hard to understsand. Loves teaching, extremely helpful if you go in his office hours and ask.",2.9,"Great teacher, hard to understand, loves teaching, extremely helpful"
"Nice professor but the exams are tricky. This class doesn\'t comprise of class notes, therefore you have to focus solely on the book (which is complex). She tries to help students boost their grade by adding an extra credit assignment. Hard class, I had to struggle to pass.",2.3,"Nice, tricky exams, complex book, extra credit, hard, struggle"
Good teacher,3.7,"Good, teacher"
Daniel is helpful and caring. He really takes pride in the accomplishments of his students. Just for the record - you spell definitely - um - d-e-f-i-n-i-t-e-l-y. Just because we\'re in the visual arts doesn\'t mean we have to be illiterate.,3.8,"helpful, caring, proud, attentive"
No Comments,3.5,NA
Makes you work but is very riveting at lecture.,2.9,"hardworking, engaging"
"Boring books, boring class, not enough student involvement. She talks for majority of class. Difficult quizes and expects a bit much. Avoid.",3.0,"Boring, not enough student involvement, talks for majority of class, difficult quizzes, expects a bit much, avoid"
I recommend anyone who has to take stats should make sure they take with her. she explains everything so well and makes sure everyone understands the material. very upbeat and refreshing which helps for a stats class- especially at night!,3.8,"recommend, explains well, upbeat, refreshing"
No Comments,4.8,NA
"there is no possible way to get an A in her class, and Im an honors student.",1.8,"difficult, challenging, unfair"
Great professor.. Have to study for the tests but she makes the class interesting.,4.1,"Great, interesting"
"I strongly recommend Dr. Giarratani; he is a master economist. He lectures from the book, but he does a fabulous job of explaining the material. He also puts his lecture slides online. The non-mandatory homework and readings are important for the tests. His tests are reasonable, and it is easy to do well if you understand the material.",3.8,"master economist, fabulous job, explaining, lecture slides online, non-mandatory homework, important, reasonable tests, easy to do well, understanding the material"
"DO NOT TAKE! She is the worst professor I\'ve ever had at RIC. Western Lit is a required Gen Ed course, and she gears it towards English Majors. Very rude, and does not care about the students at all. Requires you to buy about 14 novels, and you go through about one every week. Grading is based on her opinion of you. AWFUL!!",3.3,"worst professor, rude, uncaring, requires many novels, opinion-based grading, awful"
Great teacher! Really wants his students to get Anatomy! Just go to class and pay attention and do a little bit of studying before tests and you should be fine!!,4.0,"Great teacher, wants students to succeed, engaging, helpful, knowledgeable"
Everything you hear is absolutely TRUE. Very bad teacher and full of himself.,1.5,"bad, full of himself"
A qualified instructor who tries to get the most out of the students providing them with detailed feedback on assignments.,4.5,"qualified, instructor, detailed feedback"
"Hate science, he made me love it. Very interesting class.",4.3,"inspiring, interesting, engaging"
"Get ready for a hand cramp! Lynn is a great prof cause she knows her stuff, is clear, and organized but she doesn\'t post notes on UR courses or Web CT and will fly through the slides in class. There was so much material in this class, 19 chapters on the final and all comprehensive. Expectations for a 200 level class were a bit high.",3.2,"knowledgeable, clear, organized, fast-paced, high expectations"
No Comments,2.6,NA
"really hard class, you need to come prepared for each class to succeed. Make sure to pay attention during the lectures otherwise you\'ll be lost. READ the textbook",3.0,"hardworking, demanding, thorough, knowledgeable"
"Thankfully I\'ve been doing well in Shea\'s class but ONLY because I took Spanish in high school. My heart goes out to the students in class who really have never taken Spanish. Students sitting next to me clearly study their ass off, to no avail. Shea is unclear and doesn\'t fully address questions. Terrible at teaching. Spanish beginners, DONT TAKE!",3.1,"unclear, terrible at teaching, not beginner-friendly, unhelpful"
best professor at this school,5.0,"best, professor, school"
No Comments,4.0,NA
"Professor Stecker is one of the sweetest professors you could ever get. He loves the material, he cracks jokes, and he does a lot to help you out and also get to know you. As far as the class goes, he will assign a reading, read it before class to get the basis of knowledge and the next day he will go over it with you so you understand.",3.5,"sweet, loves the material, cracks jokes, helpful, gets to know students, assigns readings, goes over material"
"I took her social problems class a couple about a year ago... awesome class. Very hard, lots and lots of reading (stacks of articles handed out each week). Well worth it. One of the best professors at HCC. Prepares you for the four year schools!!",3.7,"hardworking, dedicated, knowledgeable, prepares well"
Clear lectures; straightforward expectations. Knows the material.,2.7,"Clear lectures, straightforward expectations, knows the material"
"She will give out homework, but she never picks it up. She will also tell us to not be scared to ask her questions but when you ask her questions she will explode and no answer your question.",3.5,"unorganized, inconsistent, unapproachable"
Knows his stuff when it comes to History of the theatre. Also very thorough in teaching directors what to consider when taking on a play.,2.8,"knowledgeable, thorough"
"she reads right off the notes, no use going to class it is so boring. But 10% of your grade goes to attendance, so better bring a book or something",3.7,"boring, reads off notes, attendance grade, NA"
"she is a very nice, kind person. She speaks spanish clearly and is willing to help you if you ask. She is very interesting in class and shows enthusiasm! you\'ll do fine on tests if you study b/c they are not super hard.",4.8,"nice, kind, clear, helpful, interesting, enthusiastic, fine, not super hard"
"I took the Summer 2012 field camp at the grad level taught by Dr. L. She was an excellent instructor who was very organized and knew what she was talking about. Never having attended NIU before, Dr. L was very accommodating, especially when I had trouble paying off my NIU field camp fees and turning in my final essay for the class,",3.7,"organized, knowledgeable, accommodating"
"Make the students do the lectures and grade tests with a grading system of a doctor. Nobody in the class could understand what their test score really is! Tests are extremely long, tedious, and mind-bobbling. going to class will not help you and needless to say he will discourage you from going into MIS. I switch my major after taking his class.",3.3,"discouraging, unclear grading system, long tests, tedious, mind-boggling"
She was very passionate abt. what she taught but not clear on what she was teaching and wanted for assignments. Overall her classes are very boring.,3.5,"passionate, not clear, boring"
This professor does not practice what he preaches. Grading system and requirements were constantly changing. Very poorly prepared for class and time spent in class not properly administrated. Spent too much time bragging about himself vs. teaching the class topic,1.5,"unprepared, inconsistent, disorganized, self-centered, bragging"
"In person (its an online class but we had a mandatory orientation for an hour), she\'s kind of hyper, a little intimidating. The online course is somewhat confusing, if you don\'t look all over the place for clues on deadlines, instructions, etc. you\'re gonna have problems. She is a bit unclear, and that is why I prefer to actually go to a classroom.",2.2,"hyper, intimidating, confusing, unclear"
Amazing professor. Love his tight jeans and boots - love his discussion of cows even more.,4.4,"Amazing, love, tight jeans, boots, discussion of cows"
"Too hard of a grader for a 101 class. GE grades, but follows Unno\'s guidelines and it\'s a bit ridiculous. I\'m no straight A student, but I do well on essays and I got a grade I wasn\'t expecting. My GE later said it\'s hard to receive an A on essays in this class. Essays are a good part of the class. First test also included Q\'s about grammar? Why?",4.3,"hard grader, follows guidelines, ridiculous, essays, grammar."
"Only three quizzes and three tests. Homework is not collected. She goes over material fast but teaches clearly. Go to class. Gives a lot of extra credit. Take her if you are pre-nursing. One of the better Stats 108 professors. It\'s hard work, but an A is definitely attainable.",4.0,"fast-paced, clear teaching, extra credit, recommended for pre-nursing, attainable A"
No Comments,4.4,NA
"This teacher seems to be very impressed with himself & discourages independent thinking. Write papers the way he wants you to write them & you will do fine. Also, seems to find humour in humiliating students. This I find unexcusable behavior in a professional. Needs to reevaluate teaching style.",4.2,"impressed, discourages independent thinking, fine, humour, humiliating, unexcusable, professional, reevaluate, teaching style"
Two huge papers...but i improved a lot on my writing with her help...keep up on your reading andyou\'ll be fine.,3.4,"improved, helpful, reading, fine"
"Mrs. Malitsky does not explain anything in class, just teaches out of the textbook word for word. The exams are ridiculously hard and the examples in the class lecture and homework do not help you prepare for them. Unless you\'re a math genius and know what you\'re doing I wouldn\'t recommend taking this class.",3.0,"unhelpful, difficult, textbook-based, not recommended"
"She uses real life situations to go along with lessons. There is homework every week, but like the rest of the class participation shows in your grade. Attendance is graded. Don\'t try to just write random stuff for homework or it will show in your test scores. I would recommend her. I will take her class every chance I get!",4.8,"engaging, practical, homework, class participation, attendance, recommended"
"Fey\'s problem is he treats students like intelligent adults, and at IVC most aren\'t.",2.8,"intelligent, adults, NA"
"At first, I thought she was interesting and painfully intelligent. Then I saw the final essay topic (8 of 11 dry, dense theorists into one 10 pg paper) and was no longer a fan. Once I wrote the paper, I realized the point behind the class and the exercise and loved her again. It\'s not easy, she makes you work and think, but Sparks is a great prof!",3.8,"intelligent, challenging, demanding, great professor"
"The questions for the papers are poorly defined and can lead to a lot of confusion when writing them. Fair grader. Very boring class, you have to read the book online so there is very little reason to go to her class.",4.2,"confusing questions, fair grader, boring class, little reason to attend"
"Great teacher! The Professor hands you an A, but it\'s up to you to go and get it. You have to attend for the quizzes which are basically completion grades, and the two major tests are all open book online. If you care about your grade, you\'ll get your A. I also learned a bit as well. Opens many ways to earn extra bonuses credits. 1 LOWEST GRADE DRO",4.8,"Great teacher, hands you an A, quizzes completion grades, open book tests, extra bonus credits, LOWEST GRADE DRO"
No Comments,1.9,NA
I agrre with the other things ststed. Just be respecful and show that your\'e trying and you\'ll do fine.,4.5,NA
Hard class if you hate theory. She does a good a good job of explaining things to you. She always makes me laugh with her accent and how she pronounces words!!! But it\'s a very time consuming class so have time on your hands for the projects!,3.3,"Hardworking, good communicator, humorous"
"Great guy but horrible professor. He does not teach from the book. He likes to pull from his previous lectures, even though it is not always correct according to the book. Like I said, great all around guy but horrible at teaching.",3.9,"Great guy, horrible professor, not teach from book, pull from previous lectures, not always correct, great all around guy, horrible at teaching"
"he\'s young, cool, and laid back but knows his stuff",4.8,"young, cool, laid back, knowledgeable"
"Simply horrible. Pedantic and narrow-minded. Dull, dull, dull. Love phil, and would\'ve majored but for this ludicrous clown. And definitely NOT hot.",3.0,"horrible, pedantic, narrow-minded, dull, ludicrous clown"
"doesn\'t really speak english. very hard to concentrate and learn from. weekly quiz on fridays that you cannot make up, no matter what reason, even if a relative dies. major jerk.",1.8,"difficult to understand, hard to concentrate, major jerk"
"McGill is a nice person, but her lectures won\'t help you at all for the tests. Brace yourself for a lot of self-learning and self-studying you will have to do. The tests will. wreck. you. But Aleks, Learning Catalytics, attendance, and participation will really boost your grade at the end of the semester so good luck.",3.8,"friendly, unhelpful lectures, self-learning, self-studying, challenging tests, wrecking tests, Aleks, Learning Catalytics, attendance, participation, grade booster"
Stick with it and it will be an easy A.,4.6,NA
cleaar your filthy ears out and listen to this man-- he knows what he is talking about and gives all he has left to do it-- best philosophy doctor in my days,2.2,"knowledgeable, passionate, best in field"
