comments,star_rating,tags
Very amusing and funny prof. Exams are easy if you read all chapters before exam and attend all lectures. exam format: 40 MC (2 pts ea) and 2 Applied free resonse problems broken into parts (10 pts ea). Final format: 1st part: 3rd non-cumulative exam (same as above). 2nd part cumulative: 40 MC drawn from practice online quizzes (identical! easy.),3.8,"amusing, funny, easy exams, lectures, cumulative, practice quizzes, identical"
"Craig loves photography and loves to teach it. He gives out weekly assignments, but they\'re typically easy. He\'s always a joy in class and teaches tips and tricks in photoshop that most people didn\'t know. He\'s been using photoshop since version 1. Take digital imaging from him, he\'s much more experienced than others teaching it.",4.8,"passionate, knowledgeable, engaging, experienced, skilled, helpful"
If you take this teacher online he is useless. Don\'t know how to work ecampus will receive incorrect grades and when you email him about it good luck getting a response,3.6,"useless, unresponsive, incorrect grades"
Has lots of experience.Very approachable. In this field we need a caring side for patients and not just Porfessor side. They both work together. She has it!,4.3,"experienced, approachable, caring"
"Solid choice for Accounting 1, wonderful professor! Highly recommend!",4.1,"Solid, wonderful, highly recommend"
Very helpful! He really understands students and is willing to work with you. One of the best professors I\'ve ever had! Really funny as well!,4.2,"helpful, understanding, willing to work with students, best professor, funny"
"She is known as ""failing feth"" she doesnt care about her student\'s grades at all and if you ask for help she laughs at you. I disliked her.",2.1,"unhelpful, uncaring, disliked"
This is the best professor I have ever had! She is extremely knowledgeable and does everything to give that knowledge to her students. Information I learned there has lasted throughout my entire college career. She is a great friend and cares about the lives of her students both in and out of the classroom. Take her class. It will impact your life.,3.7,"knowledgeable, caring, impactful, friend"
"Okay, so the trick with Kaminsky is you go to him every chance you get to check your projects. If you follow the examples you\'re given and he approves of it you\'re basically golden, otherwise, you\'re in trouble. Probably gave me the most anxeity of any professor I\'ve ever had though.",2.9,"demanding, meticulous, high expectations, anxiety-inducing"
"Well, he\'s not lining the bottom of the barrel, as some film profs are--(cough)Hendricks. However, he\'s tempermental and terribly unclear about what he wants. No effort is really required, so I\'d recommend his class to 4:20- types.",2.8,"temperamental, unclear, no effort required, recommend to 4:20-types"
"he was very nice, and definitely helpful, and his sense of humour really grows on you...he was overbearing during the male reproductive unit, but otherwise pretty good...his exams are brutal though",3.5,"friendly, helpful, sense of humor, overbearing, brutal"
rambles uncontrollably. In general he is a nice guy but completely out of his league teaching accounting. He reads straight off the slides that are all posted on sakai & can barely answer questions. His whole section of the lodmod project is a mess and he cant even help you because he is using another professors outline. This class is a mess,3.3,"rambles uncontrollably, nice guy, out of his league, reads off slides, barely answers questions, mess, using another professor's outline"
"The best English teacher at NACC. Dr. Huntley is funny, intelligent, thorough, and interesting. If you hate English like me, take her; you\'ll learn, but you\'ll have fun doing it. Also, wear Alabama colors. ;)",4.4,"funny, intelligent, thorough, interesting"
I like him because I understand him when he teaches me in class.,4.0,"like, understand, teaches"
No Comments,3.9,NA
"Best Professor, Ever! Even had our class over to his house for dinner!",4.9,"Best Professor, Ever, NA"
No Comments,3.8,NA
No Comments,5.0,NA
"Online class. Could take quizzes and tests over until you make a 100, just manage your time so you can do that. He\'s not much help when you email him. You aren\'t allowed to see the Midterm or Final and my grades were very low compared to tests, so I suspicious about the answers. One test didn\'t have them all loaded into the system. Not good to me.",1.9,"online class, quizzes, tests, time management, low grades, suspicious answers, unhelpful, not loaded, not good"
"I really enjoyed Ted Magder! His lectures were interesting and relevant. I appreciated his interest in his students opinions on current events and his humorous approach to teaching. Also, he HARDCORE reminds me of Steve Jobs.",3.8,"interesting, relevant, appreciated, humorous, hardcore"
"Frampton\'s classes are very old-fashioned, but he still seems to spark my interest. Just read his chapter before class & you will totally get his referenced, witty jokes.",3.6,"old-fashioned, sparks interest, witty"
One of the best professors I ever had. Genuinely cared about the material she taught and wanted to get you to appreciate literature more and become a better writer.,5.0,"best, genuinely cared, appreciate literature, better writer"
"Obviously loves history. This class is not an easy A, but you can do well if you go to class and do the reading. On the historical analysis papers, it\'s important to show that you understand why they are historically relevant, rather than just regurgitate them.",3.2,"passionate, challenging, engaging, knowledgeable"
"College geometry is a self taught course. She literally doesn\'t teach anything. If you don\'t know what proofs are or have a good sense of geometry, this class is NOT FOR YOU! She doesn\'t teach, she expects you to already know everything and if you don\'t know she won\'t help you.",2.3,"- self-taught, 
- doesn't teach, 
- expects students to know everything, 
- unhelpful"
"great! understandable, approachable. slides are clear, come straight from book, but i would suggest getting it anyway bc its helpful. requires work but saffran is the way to go for sure!",4.3,"approachable, clear slides, helpful, requires work, great"
"I took a 3 week summer course with Foreman. The class was brutal, and I don\'t recommend the summer course. Foreman is a great guy, knowledgeable, entertaining, and fair but one of the toughest profs for this class. You will do about 10 case studies, have 2 tests, 2 group projects, and a presentation. If you do all of the work Foreman will pass you.",3.0,"tough, knowledgeable, entertaining, fair, demanding"
No Comments,4.3,NA
"jerry is the man, definitely my favorite math teacher i\'ve had at wwu",4.4,"friendly, favorite, engaging"
"Great Professor. Very interesting guy. def take this class. If you take good notes and skim the text book the tests aren\'t too bad.Explains everything well, warm person.",3.8,"Great Professor, interesting, take this class, good notes, skim the textbook, tests aren't too bad, explains well, warm person"
I love JJ!!!! I took her for every class that I could. She was like a grandmother. She brought tea and snacks to class and allowed you to really be able to sit back and enjoy English and Literature without having to stress out about your next paper,4.3,"loving, caring, grandmotherly, accommodating, nurturing, thoughtful"
All i can say is if you want to learn in this class take someone else.,3.6,NA
I took into to cinema studies from her and loved it. Great teacher which allot of film experience. She will work with you to sharpen your writing skills. One of my favorite professors here on campus! Just be prepared to think outside the box about movies.,4.5,"Great teacher, film experience, sharpen writing skills, favorite professor, think outside the box"
good easy going guy... realy boreing tho you will fall asleep!! A++,4.5,"good, easy going, boring, fall asleep, A++"
"I have never been able to understand this subject until I took her class. She offers Extra Credit questions on Exams, making it much easier to get a higher score. Very clear and straight forward and is always willing to help if you go to her for it. Overall you could not ask for a better Professor! Highly recommended!",4.7,"knowledgeable, helpful, clear, straightforward, offers extra credit, highly recommended"
3.5 average and this class is going to bring it down. VERY difficult exams. Do not take class,3.2,"difficult exams, do not take, low average"
I just finish taking her class in Summer B (six weeks course) her class was heaven easy. I got B. I thought she was going to be harder but really she wasn\'t.,3.5,"easy, heaven, B"
She is very nice and caring. She\'ll help you when you need it! So far this class has been easy yet full of information. I would take her again if I could!,4.4,"friendly, caring, helpful, easy, informative"
"This class and the homeworks are by no means impossible if you take notes in class.He doesn\'t want to simply feed you formulas, he wants you to UNDERSTAND them and their applications, and that involves physics sometimes. In a word (or 4) he is friendly, funny, intelligent, and HELPFUL!",3.2,"friendly, funny, intelligent, helpful"
"It\'s difficult for me to rate him accurately because I already knew everything covered in CS 100 so I found the class pretty boring. Prof Cohen was still pretty interesting though because he tends to go off on tangents, although that might have a negative impact on someone who doesn\'t know the material from which he is digressing.",4.2,"boring, interesting, tangents"
very knowledgeable. hw from the textbook doesnt really help with preparing for tests. getting the solutions manual will really help (several of our problems couldnt be solved or had errors in the solution). he made a lot of mistakes working problems in class which made it easy to get confused. his multiple choice are pretty tough. Overall great guy,4.5,"knowledgeable, solutions manual, mistakes, confused, tough"
"Final grade may be 50% participation but speaking in class is really not required. I spoke about 4 times, got A\'s on papers and got an A- in the course. I think as long as she recognizes that you are reading the texts and you are paying attention in class, you\'re good in her book. If you don\'t mind reading, take her!",3.3,"approachable, understanding, lenient, fair, paper-focused"
"Great teacher. It\'s a fun subject and she is organized and clear about what she requires. The midterm and final are extremely straightforward (just do the readings at some point). The research paper is work, but the fact the subject matter is interesting, so it goes by fast. I would definitely recommend this professor and class!",4.0,"Great teacher, fun subject, organized, clear, straightforward, interesting, recommend"
"Love this class and teacher is so nice, puts everything into perspective. He is very clear, and very fair! 6 quizzes drops 2, 3 tests drops 1, one paper , and a final. Class is 90% lecture based, so showing up is important, but he leaves it up to you. Would take another class with him any day. Favorite teacher at Moorpark so far!",4.8,"nice, clear, fair, lecture-based, favorite"
I had her for newswriting and she is very unclear and tests are over too much information to even study for. Most assignments seem unplanned and on the spot most days. There are no power points provided and you\'re basically on your own. I do not recommend this teacher if you\'re truly interested in news writing and enhancing your skills.,2.7,"unclear, too much information, unplanned, no power points, not recommended"
Do not take him.,2.1,NA
"No textbooks, no midterms, no quizzes, no finals. 3 papers (2 responses and 1 final paper). Your presentation is based on your final paper. Attendance is mandatory (usually sign-in sheet). If you do not write the way he wants you to write, expect a highest of a B-. Hard to understand him but his style of teaching is recommended. Just participate!",2.9,"mandatory attendance, recommended teaching style, challenging grading, participation encouraged"
Made class more enjoyable and made a rather complicated subject understandable. Has available office hours before class and is always willing to help. He is also one of the goofiest and funniest professors I\'ve had!,4.3,"enjoyable, understandable, available, willing to help, goofy, funny"
Professor Travisano was and I presume still is second to none.,2.8,NA
A info crammer pure. He will assign a chapter and a quiz after each class. Which is easy to skate by. is unmerciful and lets satan write tests,4.1,"info crammer, pure, easy, unmerciful, satan, tests"
Brooks is not a good professor. He lectures very heavy and if you don\'t pay attention you won\'t pass. Tends to make fun of students and can be funny at times but other times he takes his jokes too far to the point where he is very disrespectful. He will not change the way he teaches the course so don\'t bother taking him for biodiversity,3.5,"disrespectful, heavy lecturer, makes fun of students, funny, won't change"
Worst teacher in my opinion.,4.0,"worst, teacher"
"Everyday is a class discussion & it\'s SUPER easy. You couldn\'t have an easier class. He takes attendance everyday, but only has class on Mon & Wed for the MWF class. You turn in a two paragraph research paper instead of coming on Friday & it\'s so simple. He reads off the answers for his tests, so write down what he says. Easy A.",4.1,"easy, class discussion, super easy, attendance, simple, two paragraph research paper, reads off answers, easy A"
"Waste of time, but added points to my GPA for an easy A. :) I\'ll take it. Show up, hang out, work out - you\'re done. Waste of $130 but whatever.",4.4,"Waste of time, easy A, show up, hang out, work out, waste of $130."
Funny Guy. He loves his job. He cares,3.9,"Funny, loves his job, cares"
Stay away if you\'re a woman!,3.3,NA
"Never had him for tutorial, but he is one of the best guys with whom to strike up a conversation. If Nietzsche entices you, Verdi is your man.",4.9,"friendly, engaging, knowledgeable"
"Very passionate about Astronomy. If you have a question, she will answer it in a way that is fun, and easy to understand. 5 large homework assignments that she will guide you on how to do it. A lot of calculations but it is gone over a lot before you do it on your own. Easy exams, lots of extra credit opportunities.",4.2,"passionate, fun, easy to understand, guides, calculations, easy exams, extra credit"
"EXTREMELY hard class. Dr. Lorden is a very nice, funny, and hyperactive professor. Her attitude helps hold your attention as the material is very dry. The workload is quite ridiculous though.",3.8,"hardworking, nice, funny, hyperactive, engaging, dry material, ridiculous workload"
"Fair. Explains and teaches the material well, very articulate... gives a good challenge. Nice guy... If you have common sense, class isn\'t too hard. Easier than my high school chem and physics classes by far.",4.1,"Fair, explains well, articulate, good challenge, nice, easier than high school."
"He is not a terrible teacher. The class is really very easy. You just have to tell him every class period that he forgot something. You can\'t expect him to do what he is supposed to. Just follow the study guide and the tests are pretty well straight off that.Also, sit in the front and talk alot. He will help you more if he knows you\'re interested.",2.0,NA
"Intelligent but bad at explaining material. Expect to teach yourself. Office hours always packed. He accuses you of skipping class and looks at you like your an idiot when you ask questions to clarify his confusing lectures. Only professor I\'ve seen yell at a student or call them a liar. A is possible, B is likely, C is common. Drop rate is high.",3.7,"Intelligent, bad at explaining, expects self-teaching, packed office hours, accuses students, looks at students like idiots, confusing lectures, yells at students, calls students liars, high drop rate."
"great teacher. if you go to class and take notes she outlines the assignments extremely clearly to make them easy to write. dont really need the book, if you have an a at the end of the class you don\'t need to take the final!",4.3,"great teacher, outlines assignments clearly, easy to write, don't need book, no final exam"
"The materials covered in this class are informative and interesting, and Prof. Cooke is helpful too. The only issue I have with the class is the opinionated questions on the quizzes.",3.2,"informative, interesting, helpful, opinionatedNA"
"He is a very straightforward teacher. He wants us to do well and not fool around. If you do all of your assignments and attend class, you will make an A+. Not hard at all. You don\'t even stay the whole class most times. Easy A.",4.7,"straightforward, wants students to do well, not fool around, easy A"
"The course itself is really hard, but if anyone was to teach it right it\'s him. It\'s clear he\'s taught this course for a while because he is so good at explaining concepts that are really tough. It takes time to understand but he makes it a lot easier, and cares about his students. Get the textbook, its worth it!",4.5,"hardworking, experienced, excellent communicator, caring, recommended textbook"
"A very nice lady, but difficult to understand and unclear about expectations. Our syllabus/calendar was useless and there is NO class participation required (something mandatory if you actually want to learn). Let\'s people misbehave like children. You can definitely phone-in this class but just try to be clear about the due dates because she isn\'t.",3.4,"difficult, unclear, useless, no class participation, misbehave like children, phone-in, not clear about due dates"
"His lectures are a bit confusing, it\'s easier to just study on your own. But he is a VERY lenient grader. Quizes are open book and tests are pretty straight forward. Not too bad",3.7,"confusing, lenient, open book, straight forward"
Great!,3.8,NA
I had Reid for S121 and freshman seminar. Reid was a very understanding and amazing professor. She knew that people got jitters speaking in front of crowds and wouldn\'t penalize you for it. She could tell who put work into their speech and she would grade accordingly. Always asked questions about your topic and was interested. Great Professor.,4.5,"understanding, amazing, interested, great professor"
"She is one of the greatest professors i\'ve had so far. She has a way of connecting real life with the things we have to learn in class to make everything interesting. You HAVE to do the reading, otherwise you\'ll fail the tests. Read and come to class and you\'ll do fine.",3.6,"great, connecting, interesting, engaging, strict"
"BEST PROF. EVER! You will learn a lot. It is an inspirational class. He is one of those teachers who is difficult to find these days. If you want a great experience and well developed phylosophy when teaching, take his class! In my professional life I would always remember Dr. Orihuela.",4.8,"inspirational, great experience, well developed philosophy, memorable"
"Former English Teacher; More concerned with mechanics; citation style; and citation style trivia then paper content, analyses or provocative ideas",3.9,"Former English Teacher, concerned, mechanics, citation style, trivia, paper content, analyses, provocative ideas"
Stoever is overflowing with knowledge and he has that sketchy genius personality that I dig in a prof. Probably one of the most influential professors I\'ve had to date.,3.2,"knowledgeable, sketchy genius personality, influential"
easy class if you go to classes. tests not too bad,3.7,"easy, classes, tests"
I had professor Fenton for College Algebra. She made all the concepts very clear and worked through problems in a very thorough manner. She always makes time for questions and will work with anyone who is having trouble with the material.,3.7,"knowledgeable, clear, thorough, approachable"
Terrible professor. Useless for help. Not a straight shooter. Contradicts himself all of the time.,2.3,"Terrible, Useless, Not a straight shooter, Contradicts himself"
"EASY, EASY, EASY and Fun!!!!",4.7,"EASY, FUN"
"his lectures are boring, i got an A in class, never opened my book. He gives you a pretest with answers, pretest has exactly the same questions as the test. easy easy easy teacher!!!!",4.1,"boring, easy, pretest with answers, same questions, A grade"
"Good for an elective. Didn\'t get a lot from his classes, and his lack of clarity/guidance left me in the dark at times. VERY odd at times, just say what he wants you to hear. I think he\'s too old to care too much anymore what others think..?",2.8,"Good, elective, lack of clarity, guidance, odd, too old, uncaring"
"She is a nice lady, her sense of humour takes some getting used to. If she senses you are doing your work and trying hard she will encourage you, if not look out! One thing that really bothered me in this class is the fact that it\'s an intro. to spanish class, yet we have 5-7 people who speak spanish in the class! Shame on you!",2.4,"nice, sense of humour, encouraging, intro to spanish, shame"
"Great class, very clear lectures. Focused on helping us understand the concepts in depth. Homework policy is very fair (and TA was helpful). Every other professor at UCI that taught about P/NP-completeness left me confused and scared (Eppstein, I\'m looking at you) but Arvo made it clear and intuitive.",4.6,"Great, clear lectures, focused, fair homework policy, helpful TA, clear, intuitive."
"Craig is amazing. At first you\'ll find him quirky and different but he grows on you. I made the mistake of missing lecture a lot and that really affected my grade because EACH lecture he grades and gives points for participation. He does offer A LOT of extra credit and his discussions are outdoor and super hands on. We did a lot, good experience",3.9,"amazing, quirky, grows on you, grades participation, offers extra credit, hands on, good experience"
"Professor Handschuh is a caring, entertaining and informative educator. While the class is Photojournalism, he teaches about the business of photojournalism and emotional care for journalists and how to market yourself as a photographer or writer and this is really valuable information. Highly recommended class!",4.3,"caring, entertaining, informative, valuable, recommended"
"She is a so so teacher. She truly cares about the students. Be prepared to learn the majority of the content on your own. I got an A in this class, she is a very easy grader. The people who said she was a tough grader and gave hard exams, are the ones who did not prepare. This is a tough subject, you need to study.",1.9,"caring, easy grader, tough subject, study"
"The class is really boring, she talks to fast and never explains what she wants from you. A lot of reading and writing in this class. Be prepared for her to tear your paper apart, she over analyzes everything. She is definitely not a fair grader.",3.0,"boring, talks too fast, not clear, lot of reading, lot of writing, tears paper apart, over analyzes, not fair grader"
"LOTS OF PHYSICS INVOLVED!!! I\'m not a mathematical genius so this class and the test\'s were slightly confusing at times. Overall a good class though, I really received the help I needed when I needed it. I would recommend her .",4.2,"confusing, helpful, recommended"
"I would definitely recommend Foreman! The three week summer course was a lot of work but the class is discussion based so as long as you read the case studies you are fine. He is very laid back and entertaining. There is a lot of writing and analysis in this course, but as long as he is seeing you are putting forth effort your grade will be fine",3.0,"laid back, entertaining, discussion-based, recommend, writing, analysis, effort, grade fine"
not the most interesting class..just the usuall run over notes and one or two in class assignments..testing is based on what she talks about ..this class is missing something to catch student attention,2.8,NA
"While he does not give as much homework as some of the other professors, he likes to assign it on a very short deadline (I.E. finish the chapter on monday, homework is pushed up to be due that wednesday). Attendance was required as he gave in class clicker questions everyday that count as participation (but also are graded). Kinda sassy guy.",2.3,"strict, short deadlines, required attendance, clicker questions, sassy"
"She\'s very popular, and I\'ve never understood why. I found her class tedious and her style annoying. She\'s also quite arrogant.",4.4,"popular, tedious, annoying, arrogant"
Typical writing of papers every week. Kind of interesting when she went off on tangents. Not her fault that critical reading is very high school. I would take her again.,4.7,"- typical writing of papers every week, interesting, tangents, critical reading, high school, would take again"
"She\'s a very sweet lady, but the class was rediculously easy and a waste of time. It was difficult to understand what she wanted at times. Wonderful lady, below average professor.",4.1,"sweet, easy, waste of time, difficult, wonderful, below average"
Ms. Ruttenbur was extremely helpful in class. She made it a priority for all students to participate and grasp the information. She wanted us to learn the material and not simply memorize text.,3.4,"helpful, priority, participate, grasp, learn, material"
No Comments,4.3,NA
